
<schema targetNamespace="http://david.moten.org/xuml" xmlns:t="http://david.moten.org/xuml"
	xmlns="http://www.w3.org/2001/XMLSchema" elementFormDefault="qualified">

	<element name="system" type="t:system" />

	<complexType name="system">
		<sequence>
			<element name="class" type="t:class" minOccurs="0" maxOccurs="unbounded" />
			<element name="relationship" type="t:relationship" minOccurs="0"
				maxOccurs="unbounded" />
			<element name="generalization" type="t:generalization"
				minOccurs="0" maxOccurs="unbounded" />
			<element name="association" type="t:association" minOccurs="0"
				maxOccurs="unbounded" />
		</sequence>
	</complexType>

	<complexType name="class">
		<complexContent>
			<extension base="t:classWithDomain">
				<sequence>
					<element ref="t:attribute" maxOccurs="unbounded" />
					<element name="operation" type="t:operation" maxOccurs="unbounded"
						minOccurs="0" />
				</sequence>
			</extension>
		</complexContent>
	</complexType>

	<element name="attribute" type="t:attribute" />
	<element name="native" substitutionGroup="t:attribute" type="t:nativeAttribute" />
	<element name="referential" substitutionGroup="t:attribute"
		type="t:referentialAttribute" />

	<complexType name="attribute">
		<sequence>
			<element name="identifier" type="t:identifier" minOccurs="0"
				maxOccurs="unbounded" />
		</sequence>
		<attribute name="name" type="t:nonBlankString"/>
	</complexType>

	<complexType name="identifier">
		<attribute name="name" type="t:nonBlankString" />
	</complexType>

	<complexType name="nativeAttribute">
		<complexContent>
			<extension base="t:attribute">
				<attribute name="type" type="t:nativeAttributeType" />
				<attribute name="mandatory" type="boolean" use="optional"
					default="true" />
			</extension>
		</complexContent>
	</complexType>

	<simpleType name="nativeAttributeType">
		<restriction base="string">
			<enumeration value="Decimal" />
			<enumeration value="Integer" />
			<enumeration value="Boolean" />
			<enumeration value="Timestamp" />
			<enumeration value="Date" />
			<enumeration value="String" />
			<enumeration value="ArbitraryId" />
		</restriction>
	</simpleType>

	<complexType name="referentialAttribute">
		<complexContent>
			<extension base="t:attribute">
				<attribute name="otherAttribute" type="t:nonBlankString" use="optional"/>
				<attribute name="relationship" type="t:nonBlankString" />
			</extension>
		</complexContent>
	</complexType>

	<complexType name="operation">
		<sequence>
			<element name="parameter" type="t:parameter" minOccurs="0"
				maxOccurs="unbounded" />
		</sequence>
		<attribute name="name" type="t:nonBlankString" />
		<attribute name="returns" type="t:nonBlankString" use="optional" />
	</complexType>

	<complexType name="parameter">
		<attribute name="name" type="t:nonBlankString" />
		<attribute name="type" type="t:nonBlankString" />
	</complexType>

	<complexType name="relationship">
		<sequence>
			<element name="class1" type="t:relationshipEnd" />
			<element name="class2" type="t:relationshipEnd" />
		</sequence>
		<attribute name="name" type="t:nonBlankString" />
	</complexType>

	<complexType name="relationshipEnd">
		<complexContent>
			<extension base="t:classWithDomain">
				<attribute name="verbClause" type="t:nonBlankString" />
				<attribute name="multiplicity" type="t:multiplicity" />
			</extension>
		</complexContent>
	</complexType>

	<simpleType name="multiplicity">
		<restriction base="string">
			<enumeration value="ZERO_ONE" />
			<enumeration value="ONE" />
			<enumeration value="MANY" />
			<enumeration value="ONE_MANY" />
		</restriction>
	</simpleType>

	<complexType name="generalization">
		<sequence>
			<element name="superClass" type="t:classWithDomain" />
			<element name="class" type="t:classWithDomain" maxOccurs="unbounded" />
		</sequence>
		<attribute name="name" type="t:nonBlankString" />
	</complexType>

	<complexType name="classWithDomain">
		<attribute name="name" type="t:nonBlankString" />
		<attribute name="domain" type="t:nonBlankString" />
	</complexType>

	<complexType name="association">
		<complexContent>
			<extension base="t:classWithDomain">
				<attribute name="relationshipName" type="t:nonBlankString" />
			</extension>
		</complexContent>
	</complexType>

	<simpleType name="nonBlankString">
		<restriction base="string">
			<pattern value=".*[^\s].*" />
		</restriction>
	</simpleType>

</schema>